{
  "url": "https://www.besttour.com.tw/itinerary/TYO06MM260213AM2",
  "scraped_at": "2026-01-28T15:19:50.397037",
  "title": "【機加酒．東京自由行５日】樂桃5+1天、新橋區、濱松町TAVINOS HAMAMATSUCHO、日式漫畫風、含輕食早餐｜日本｜喜鴻假期",
  "raw_text": "TYO06MM260213AM2\n喜遊馬年鴻運來【機加酒．東京自由行５日】樂桃5+1天、新橋區、濱松町TAVINOS HAMAMATSUCHO、日式漫畫風、含輕食早餐\n*JR:「濱松町」站北口步行約8分鐘\n*地鐵:海鷗線竹芝站步行1分鐘 (直通)\n自都營大江戶線站B2出口步行約8分鐘,搭電梯自B4出口步行約8分鐘,自東京單軌電車「濱松町」站步行約8分鐘\n*機場:\n*從羽田機場乘坐東京單軌電車時：從“羽田機場第一航站樓”乘坐開往濱松町的火車，在“濱松町站”下車，步行10分鐘。\n*從成田機場使用京成SKYLINER時：從“機場2號航站樓\n已售完\n選擇出發日期\n2月 2026\n日\n一\n二\n三\n四\n五\n六\n1\n2\n3\n4\n5\n滿團\n19888+\n6\n滿團\n19888+\n7\n8\n9\n10\n11\n滿團\n21388+\n12\n滿團\n23388+\n13\n滿團\n27888+\n14\n可售：2\n34888+\n15 春節\n可售：2\n33888+\n16 除夕\n可售：2\n33888+\n17 春節\n滿團\n35388+\n18 春節\n滿團\n34388+\n19 春節\n滿團\n27388+\n20 補假\n可售：2\n23388+\n21\n可售：2\n19888+\n22\n可售：2\n18388+\n23\n滿團\n18388+\n24\n可售：2\n19388+\n25\n滿團\n22888+\n26\n可售：2\n22888+\n27 補假\n滿團\n22888+\n28 和平\n滿團\n22888+\n選擇行程\n2026/2/5\n星期四\nTYO05MM260205AM 桃園出發\nMM626 樂桃航空 10:40 → 14:55\n滿團\nTWD19,888起\n2026/2/6\n星期五\nTYO05MM260206AM 桃園出發\nMM626 樂桃航空 10:40 → 14:55\n滿團\nTWD19,888起\n2026/2/11\n星期三\nTYO05MM260211AM 桃園出發\nMM626 樂桃航空 10:40 → 14:55\n滿團\nTWD21,388起\n2026/2/12\n星期四\nTYO05MM260212AM 桃園出發\nMM626 樂桃航空 10:40 → 14:55\n滿團\nTWD23,388起\n2026/2/12\n星期四\nTYO05TR260212HO 桃園出發\nTR898. 酷航空 06:40 → 10:40\n滿團\nTWD24,500起\n2026/2/13\n星期五\nTYO06MM260213AM2 桃園出發\nMM620 樂桃航空 02:25 → 06:30\n滿團\nTWD27,888起\n2026/2/14\n星期六\nTYO06MM260214AM2 桃園出發\nMM620 樂桃航空 02:25 → 06:30\n可售：2\nTWD34,888起\n2026/2/15\n星期日\nTYO06MM260215AM2 桃園出發\nMM620 樂桃航空 02:25 → 06:30\n可售：2\nTWD33,888起\n2026/2/16\n星期一\nTYO06MM260216AM2 桃園出發\nMM620 樂桃航空 02:25 → 06:30\n可售：2\nTWD33,888起\n2026/2/17\n星期二\nTYO05MM260217AM 桃園出發\nMM626 樂桃航空 10:40 → 14:55\n滿團\nTWD35,388起\n2026/2/18\n星期三\nTYO05MM260218AM 桃園出發\nMM626 樂桃航空 10:40 → 14:55\n滿團\nTWD34,388起\n2026/2/19\n星期四\nTYO05MM260219AM 桃園出發\nMM626 樂桃航空 10:40 → 14:55\n滿團\nTWD27,388起\n2026/2/20\n星期五\nTYO05MM260220AM 桃園出發\nMM626 樂桃航空 10:40 → 14:55\n可售：2\nTWD23,388起\n2026/2/20\n星期五\nTYO06MM260220AMA 桃園出發\nMM620 樂桃航空 02:25 → 06:30\n可售：2\nTWD33,888起\n2026/2/21\n星期六\nTYO05MM260221AM 桃園出發\nMM626 樂桃航空 10:40 → 14:55\n可售：2\nTWD19,888起\n2026/2/21\n星期六\nTYO06MM260221AMA 桃園出發\nMM620 樂桃航空 02:25 → 06:30\n可售：2\nTWD33,888起\n2026/2/22\n星期日\nTYO05MM260222AM 桃園出發\nMM626 樂桃航空 10:40 → 14:55\n可售：2\nTWD18,388起\n2026/2/23\n星期一\nTYO05TR260223HO 桃園出發\nTR898. 酷航空 06:40 → 10:40\n滿團\nTWD18,388起\n2026/2/23\n星期一\nTYO05MM260223AM 桃園出發\nMM626 樂桃航空 10:40 → 14:55\n可售：2\nTWD18,588起\n2026/2/24\n星期二\nTYO05MM260224AM 桃園出發\nMM626 樂桃航空 10:40 → 14:55\n可售：2\nTWD19,388起\n2026/2/25\n星期三\nTYO05MM260225AM 桃園出發\nMM626 樂桃航空 10:40 → 14:55\n滿團\nTWD22,888起\n2026/2/26\n星期四\nTYO05TR260226HO 桃園出發\nTR898. 酷航空 06:40 → 10:40\n可售：2\nTWD22,888起\n2026/2/27\n星期五\nTYO05MM260227AM 桃園出發\nMM626 樂桃航空 10:40 → 14:55\n滿團\nTWD22,888起\n2026/2/28\n星期六\nTYO05MM260228AM 桃園出發\nMM626 樂桃航空 10:40 → 14:55\n滿團\nTWD22,888起\n2026/3/2\n星期一\nTYO05TR260302HO 桃園出發\nTR898. 酷航空 06:40 → 10:40\n可售：2\nTWD17,999起\n2026/3/3\n星期二\nTYO05MM260303AM 桃園出發\nMM626 樂桃航空 10:40 → 14:55\n可售：2\nTWD20,988起\n2026/3/4\n星期三\nTYO05MM260304AM 桃園出發\nMM626 樂桃航空 10:40 → 14:55\n滿團\nTWD21,388起\n2026/3/9\n星期一\nTYO05TR260309HO 桃園出發\nTR898. 酷航空 06:40 → 10:40\n可售：2\nTWD18,388起\n2026/3/10\n星期二\nTYO05MM260310AM 桃園出發\nMM626 樂桃航空 10:40 → 14:55\n可售：2\nTWD19,900起\n2026/3/11\n星期三\nTYO05MM260311AM 桃園出發\nMM626 樂桃航空 10:40 → 14:55\n可售：2\nTWD20,888起\n2026/3/12\n星期四\nTYO05MM260312AM 桃園出發\nMM626 樂桃航空 10:40 → 14:55\n可售：2\nTWD20,588起\n2026/3/13\n星期五\nTYO05MM260313AM 桃園出發\nMM626 樂桃航空 10:40 → 14:55\n可售：2\nTWD20,388起\n2026/3/14\n星期六\nTYO05MM260314AM 桃園出發\nMM626 樂桃航空 10:40 → 14:55\n可售：2\nTWD19,888起\n2026/3/15\n星期日\nTYO05TR260315HO 桃園出發\nTR898. 酷航空 06:40 → 10:40\n滿團\nTWD15,999起\n2026/3/17\n星期二\nTYO05TR260317HO 桃園出發\nTR898. 酷航空 06:40 → 10:40\n可售：2\nTWD18,388起\n2026/3/19\n星期四\nTYO05TR260319HO 桃園出發\nTR898. 酷航空 06:40 → 10:40\n可售：2\nTWD18,888起\n2026/3/19\n星期四\nTYO05MM260319AM 桃園出發\nMM626 樂桃航空 10:40 → 14:55\n可售：2\nTWD20,988起\n2026/3/20\n星期五\nTYO05MM260320AM 桃園出發\nMM626 樂桃航空 10:40 → 14:55\n可售：2\nTWD20,688起\n2026/3/21\n星期六\nTYO05MM260321AM 桃園出發\nMM626 樂桃航空 10:40 → 14:55\n可售：2\nTWD21,588起\n2026/3/22\n星期日\nTYO05MM260322AM 桃園出發\nMM626 樂桃航空 10:40 → 14:55\n可售：2\nTWD22,088起\n2026/3/23\n星期一\nTYO05TR260323HO 桃園出發\nTR898. 酷航空 06:40 → 10:40\n可售：2\nTWD20,800起\n2026/3/23\n星期一\nTYO05MM260323AM 桃園出發\nMM626 樂桃航空 10:40 → 14:55\n可售：2\nTWD22,888起\n2026/3/24\n星期二\nTYO05MM260324AM 桃園出發\nMM626 樂桃航空 10:40 → 14:55\n可售：2\nTWD23,888起\n2026/4/1\n星期三\nTYO05TR260401HO 桃園出發\nTR876. 酷航空 06:45 → 11:10\n可售：2\nTWD26,888起\n2026/4/6\n星期一\nTYO05TR260406HO 桃園出發\nTR876. 酷航空 06:45 → 11:10\n可售：2\nTWD20,888起\n2026/4/9\n星期四\nTYO05TR260409HO 桃園出發\nTR876. 酷航空 06:45 → 11:10\n可售：2\nTWD20,388起\n2026/4/23\n星期四\nTYO05TR260423HO 桃園出發\nTR876. 酷航空 06:45 → 11:10\n可售：2\nTWD18,888起\n2026/5/21\n星期四\nTYO05TR260521HO 桃園出發\nTR876. 酷航空 06:45 → 11:10\n可售：2\nTWD17,988起\n2026/5/23\n星期六\nTYO05TR260523HO 桃園出發\nTR876. 酷航空 06:45 → 11:10\n可售：2\nTWD17,888起\n2026/6/4\n星期四\nTYO05TR260604HO 桃園出發\nTR876. 酷航空 06:45 → 11:10\n可售：2\nTWD18,388起\n2026/6/20\n星期六\nTYO05TR260620HO 桃園出發\nTR876. 酷航空 06:45 → 11:10\n可售：2\nTWD18,988起\n2026/6/22\n星期一\nTYO05TR260622HO 桃園出發\nTR876. 酷航空 06:45 → 11:10\n滿團\nTWD16,988起\n2026/6/25\n星期四\nTYO05TR260625HO 桃園出發\nTR876. 酷航空 06:45 → 11:10\n可售：2\nTWD19,888起\n2026/7/1\n星期三\nTYO05TR260701HO 桃園出發\nTR876. 酷航空 06:45 → 11:10\n可售：2\nTWD19,500起\n2026/7/5\n星期日\nTYO05TR260705HO 桃園出發\nTR876. 酷航空 06:45 → 11:10\n可售：2\nTWD17,988起\n2026/7/22\n星期三\nTYO05TR260722HO 桃園出發\nTR876. 酷航空 06:45 → 11:10\n可售：2\nTWD18,588起\n2026/8/2\n星期日\nTYO05TR260802HO 桃園出發\nTR876. 酷航空 06:45 → 11:10\n可售：2\nTWD17,988起\n2026/8/20\n星期四\nTYO05TR260820HO 桃園出發\nTR876. 酷航空 06:45 → 11:10\n可售：2\nTWD17,988起\n2026/9/3\n星期四\nTYO05TR260903HO 桃園出發\nTR876. 酷航空 06:45 → 11:10\n可售：2\nTWD17,500起\n2026/9/12\n星期六\nTYO05TR260912HO 桃園出發\nTR876. 酷航空 06:45 → 11:10\n可售：2\nTWD16,988起\n2026/10/4\n星期日\nTYO05TR261004HO 桃園出發\nTR876. 酷航空 06:45 → 11:10\n可售：2\nTWD16,388起\n2026/10/5\n星期一\nTYO05TR261005HO 桃園出發\nTR876. 酷航空 06:45 → 11:10\n可售：2\nTWD16,888起\n2026/10/15\n星期四\nTYO05TR261015HO 桃園出發\nTR876. 酷航空 06:45 → 11:10\n可售：2\nTWD17,588起\n交通\n方式\n行程\n特色\n行程\n介紹\n注意\n事項\n交通方式\n去程\n2026/02/13\nMM620\n樂桃航空\n桃園(TPE)\n02:25\n→\n東京[成田](NRT)\n06:30\n回程\n2026/02/17\nMM627\n樂桃航空\n東京[成田](NRT)\n22:05\n→\n桃園(TPE)\n01:25+1\n實際交通資訊以說明會資料為主\n行程特色\n食尚讚住\n◆濱松町TAVINOS◆\n\n打開房門的那一瞬間，心情彷彿躍入「MANGA（漫畫）」世界的獨特客房。\n★交通：\n・從海鷗線竹芝站步行1分鐘 (直通)\n・自JR「濱松町」站北口步行約8分鐘\n・自都營大江戶線「大門」站B2出口步行約8分鐘\n（搭電梯自B4出口步行約8分鐘）\n・自東京單軌電車「濱松町」站步行約8分鐘\n・從成田機場使用京成Skyliner時：從“機場2號航站樓”乘坐開往京成上野的Keisei Limited Express Skyliner。大約30分鐘後，在“日暮里站”下車，然後轉乘JR京濱東北線/根岸線。乘坐“大船線”在“ Hamamatsucho”站下車。步行10分鐘\n★設施：\n全館免費WIFI\n溫馨提醒\n※ 飯店房型若無特別指定，將一律以非吸菸房訂出，但實際房型需以飯店安排為主。\n※ 若於下述報價中無您喜愛的酒店，可另外提供您所期望的酒店另行報價，本公司將針對您的需求量身規劃屬於您的專屬假期。\n- 不保證所有酒店皆有報價。\n※ 若遇跨年、過年需另外報價。\n\n✍【注意事項】\n出發前請詳閱日本在台交流協會網站相關法規\n//www.koryu.or.jp/tw/\n● 本行程使用機票，須同進同出，一經確認後如個人因素取消或被拒絕入境日本，將無法申請退費。\n● 每位旅客姓名的英文拼音必須與護照完全相同，開票前敬請務必確認，如有錯誤，本公司有權收取變更所衍生之費用。\n● 行程最終使用之正確航班以行前說明會資料為準，航班時間部份，航空公司保留彈性調整之權利，不便之處敬請見諒！\n● 保證住房：距入住日7個工作天內或飯店所在城市有大型展覽、或當地旺季之飯店預訂，均為保證住房之期間，需先之付「保證住房作業金」後始可開始訂房作業，確認保證入住後之任何取消或變更將無法預付之費用。若您需求的飯店客滿，我們將建議同等級飯店，您可選擇接受或補差額。\n(保證訂房並不表示您所需求的飯店一定有房，但若有房則不可取消訂房。)\n✈註：由於酒店售價波動頻繁，表列報價只能以平日正常酒店入住費用為報價基準；若遇調漲或會展期間或各種其它狀況時，我們將會於您訂購後，與您確認相關正確費用，不便之處，尚請多多見諒。\n行程介紹\n第 1 天\n桃園／東京\n餐食\n早\nx\n午\nx\n晚\nx\n住宿\nHOTEL TAVINOS濱松町\n或同級\n第 2 天\n東京自由行\n餐食\n早\n輕食早餐\n午\nx\n晚\nx\n住宿\nHOTEL TAVINOS濱松町\n或同級\n第 3 天\n東京自由行\n餐食\n早\n輕食早餐\n午\nx\n晚\nx\n住宿\nHOTEL TAVINOS濱松町\n或同級\n第 4 天\n東京自由行\n餐食\n早\n輕食早餐\n午\nx\n晚\nx\n住宿\nHOTEL TAVINOS濱松町\n或同級\n第 5 天\n東京／桃園\n餐食\n早\n輕食早餐\n午\nx\n晚\nx\n住宿\n第 6 天\n桃園\n餐食\n早\nX\n午\nX\n晚\nX\n住宿\n注意事項\n參團須知\n1.每位旅客姓名的英文拼音必須與護照完全相同，若已開立機票則不可變更，一經開票無退票價值。航班時間以航空公司公告為主。為確保航班臨時異動可即時通知，請旅客務必提供正確的聯絡電話。\n2.本網站報價將因機票、飯店、匯率等各種因素而時有變動，得依完成訂購後的報價為準。\n3.本網站行程住宿之飯店優惠對象為持台灣護照之國人，持外國護照入住者須另行報價，且請先自行查明相關規定，並務必於報名時，明白告知您的客服人員。\n4.旅客若報名參加自由行，本公司並無提供收取旅客護照之服務(即旅客需自行保管、攜帶)，故請您務必自行檢查護照相關使用規定，如：有效期限(6個月以上)、役男問題、頁數等，若有任何問題，請洽您的客服人員。\n5.每種房型都有入住人數限制，若當地有親友加入，超出原先的安排，飯店有權拒絕旅客入住或要求旅客支付差價。\n6.本網站標示的飯店星級別乃依據旅遊市場一般公認的建議而定，並非本公司之主觀認定。\n護照效期與簽證須知\n1.本行程適用對象均為持中華民國護照之旅客(至出國當日護照效期需六個月以上)，若貴賓擁有雙重國籍或持他國護照，請先自行查明出入境(台灣入出國及移民署全球資訊網、日本交流協會台灣事務所)之相關規定，報名時並請主動告知您的服務人員。\n\n日本在台交流協會<br>\n飯店說明\n1.飯店住宿為全程兩人一室，一人報名請補單人房差價。若一位大人加一位小孩同行，小孩則必需佔床。\n2.床型如有特殊需求請提前告知，只能需求但是不能保證以實際當地入住為主。\n3.訂房一經確認後，如要取消飯店將收取取消費，尤其以五星級飯店最為嚴格，請務必在訂房時確認您的需求，謝謝！\n4.房型定義：\n單人房(SGL)：標準的單人房一張床。\n雙人房一中床(SEMI-DBLB)：單人房加床或較小的雙人房(房型需以飯店安排為主)，房間面積及床的尺寸都較小，若可接受再行預訂。\n雙人房一張床(DBLB)：標準的雙人房一張床。\n雙人房二張床(TWIN)：標準的雙人房二張床。\n三人房(TRP)：雙人房(一張床或是二張床)再加床，加床方式可能為行軍床或是沙發床或是標準單床(房型需以飯店安排為主)。\n**出發後若有任何房型變更需視飯店現場情況，費用亦須以飯店現場價格為準。\n\n5.部分酒店不提供個人用品（如：毛巾、牙刷、牙膏、沐浴乳、洗髮精、香皂、拖鞋及個人習慣性藥品等）請自行攜帶。若須多加備品、寢具等，部分酒店須自行至櫃台付費領取。\n6.通常入住(Check-in)時間約為當地時間15：00；退房(Check-out)時間為當地時間中午11：00或12：00前；實際情形仍須視各酒店規定。如有提前住房、延後退房，請自行與酒店洽詢。\n7.自由行旅客請特別注意：國外飯店常有《押金入住》規定。當辦理Checkin時，飯店會要求收取押金(可押現金或刷卡)。現金金額須視飯店規定，刷卡則為一張空白帳單。當辦理Checkout時務必取回現金或當場撕毀刷卡單，以確保個人權益。\n『東京、大阪、京都、金澤市、俱知安町、(2020年4月起)福岡』當地市政府針對旅客加收住宿城市稅，收取金額約為日幣100~1000/每人每晚，「俱知安町」將以總房費的2%作為宿泊稅，實際費用依照房費而定；『大阪、部分城市』溫泉設施旅館收取入湯税日幣150起/每人每晚，稅金費用須直接由客人於飯店現場支付，並非所有飯店皆會收取，請於飯店現場確認。\n8.因各飯店辦理入住年齡限制不一，未滿20歲旅客請於需求訂房時與客服人員再次確認飯店是否可辦理入住。\n9.特殊需求（如：床型一大床或二小床、高或低樓層、吸煙或禁煙房、非邊間或連通房等）請事先告知業務，業務僅代向飯店提出需求。實際情況仍須視飯店當日房況安排而定。\n10.兒童不佔床，指2-12歲不佔床位的兒童，一般飯店一間房僅允許一名不佔床與大人同住，若一大+一小不佔床入住雙人房，仍是需要付兩個人的房間費用。一般6歲以上小孩就必須佔床(實際依飯店規定為主)\n航空票務相關提醒\n1.※如訂購低成本航空(TR.MM.IT等…)產品提醒如下\n(為免爭議請於購買前詳細閱讀，一經付款完成代表您了解並全權同意以下規範。)\n\n2.本行程使用團體經濟艙票種來回，坐位安排照英文姓名字母順序，同行旅客不一定相鄰，無法免費選位，若有需求可於開票前自費加價選位。\n3.每位佔位旅客皆含去/回程各20公斤託運行李及一件手提行李(尺寸需小於54cmx38cmx23cm，上述尺寸包含輪子及手把等外部突出物)，與一件個人隨身物品(如手提包、電腦包或免稅商品)，共計二件，總重不得超過7公斤(樂桃/酷航)10KG(台虎);嬰兒票恕不提供任何免費行李托運或手提行李件數。\n4.注意事項及退票規定：機位一經開票確認後不可更改航班、日期與行程、不可退費，亦無法加價選位、加購機上餐食及加購託運行李等作業，也不可更改姓名或拼音，恕無法提供相關退費證明。\n5.取消規定：若因旅客個人因素取消行程，將收取全額機票費用；若因天災等不可抗力之因素致班機延誤或取消，不提供旅客轉乘其他航空公司班機之服務、亦不提供安排旅客住宿之服務，建議您另外加購相關保險。\n6.回程日計算未滿2歲需購買嬰兒票。因應航空公司飛安政策，每個航班僅提供10席嬰兒不佔位，(訂位時請事先告知並提供護照英文名和出生年月日)，如指定搭乘航班嬰兒人數超過規定限制、導致無法偕同嬰兒同行，可全額退費。一位成人僅能偕同一位不佔位嬰兒坐在膝上。(恕不提供搖籃服務)；免費提供一件嬰兒推車託運，不提供座位/嬰兒搖籃/託運行李/機上餐食。\n7.孕婦搭乘之規定會因各航空公司而有所不同，一般懷孕二十八至三十六週須請產檢醫生填寫航空公司專用診斷書，三十六週後須醫護人員同行搭乘或禁止搭乘，相關規定依航空公司之規定為主。\n8.航空公司保有最終航班時間及託運行李規定之變更權利，如有異動請依航空公司官網公告為準，恕不另行通知不便之處，敬請見諒。\n自由行旅遊商品作業金繳交規範作業約定\n其他相關資訊\n1.【電壓】\n日本電壓100伏特，一般旅館的電流都有110和220伏特。\n2.※訂位作業相關規定\n(1)本行程當您確認行程與出發日之後，請於訂購時支付NT$10,000起/人作為作業金(特殊節假日除外)，若訂位與訂房皆確認OK，則作業金自動轉為訂金，若遇原訂機位艙等或飯店已滿，請旅客加價其他艙等或另擇出發日期或退還作業金。\n(2)請務必先給旅客「謢照影本」來作業。\n\n3.※訂房相關規定\n(1)訂房後最晚兩個工作天回覆訂房狀況，如逢所訂飯店或房型客滿時，本公司將以同級飯店替代或升等房型（旅客需補房型升等價差），或是退還費用，造成您的不便敬請見諒，並請恕無法賠償！\n(2)本行程飯店若需全程保證入住，訂房一經確認後，如取消或變更將收取全額房間之取消費，若有不足之費用，則需補足全額房間費用，請謹慎確認。\n(3)由於酒店售價波動頻繁，表列報價只能以平日正常酒店入住費用為報價基準；本行程外網所秀出的售價，為此區段出發時間之最低售價，並非適用所有出發日期及所有飯店，若遇調漲或會展期間或各種其它狀況時，我們將會於您訂購後，與您確認相關正確費用，不便之處，尚請多多見諒。\n4.【時差】\n較台灣快約一小時。\n喜鴻旅行社股份有限公司（綜合旅行社）\n統一編號：70381925\n總公司地址：台北市中山區松江路148號6樓之2\n交觀綜2094\n品保北1162\n負責人：葉友芳\n匯款帳號：合作金庫長春分行（銀行代號006）\n戶名：喜鴻旅行社股份有限公司\n帳號：0844-717-214289\n© 2024 HSI HUNG TRAVEL SERVICE CO.,LTD.\n訂閱 喜鴻假期LINE 官方帳號\n點擊以下按鈕可獲得最新資訊👇\n連結 LINE 帳號\n \n喜鴻集團線上客服\n您好，很高興為您服務！❤️\n如有任何問題，歡迎在下方【輸入訊息】與我們聯絡～\n \n回覆至 喜鴻集團線上客服",
  "extracted": {
    "flight": {
      "outbound": {
        "date": "2026/02/13",
        "flight_number": "MM620",
        "airline": "樂桃航空",
        "departure_airport": "桃園(TPE)",
        "departure_time": "02:25",
        "arrival_airport": "東京[成田](NRT)",
        "arrival_time": "06:30",
        "departure_code": "TPE",
        "arrival_code": "NRT"
      },
      "return": {
        "date": "2026/02/17",
        "flight_number": "MM627",
        "airline": "樂桃航空",
        "departure_airport": "東京[成田](NRT)",
        "departure_time": "22:05",
        "arrival_airport": "桃園(TPE)",
        "arrival_time": "01:25+1",
        "departure_code": "NRT",
        "arrival_code": "TPE"
      }
    },
    "hotel": {},
    "price": {},
    "dates": {},
    "inclusions": []
  },
  "extracted_elements": {
    "price_element": [
      "19888+",
      "19888+",
      "21388+",
      "23388+",
      "27888+"
    ],
    "price_class": [
      "19888+",
      "19888+",
      "21388+",
      "23388+",
      "27888+"
    ],
    "flight_class": [
      "MM626 樂桃航空 10:40 → 14:55",
      "MM626 樂桃航空 10:40 → 14:55",
      "MM626 樂桃航空 10:40 → 14:55",
      "MM626 樂桃航空 10:40 → 14:55",
      "TR898. 酷航空 06:40 → 10:40"
    ],
    "content": [
      "2月 2026\n日\n一\n二\n三\n四\n五\n六\n1\n2\n3\n4\n5\n滿團\n19888+\n6\n滿團\n19888+\n7\n8\n9\n10\n11\n滿團\n21388+\n12\n滿團\n23388+\n13\n滿團\n27888+\n14\n可售：2\n34888+\n15 春節\n可售：2\n33888+\n16 除夕\n可售：2\n33888+\n17 春節\n滿團\n35388+\n18 春節\n滿團\n34388+\n19 春節\n滿團\n27388+\n20 補假\n可售：2\n23388+\n21\n可售：2\n19888+\n22\n可售：2\n18388+\n23\n滿團\n18388+\n24\n可售：2\n19388+\n25\n滿團\n22888+\n26\n可售：2\n22888+\n27 補假\n滿團\n22888+\n28 和平\n滿團\n22888+",
      "滿團\n19888+",
      "滿團\n19888+",
      "滿團\n21388+",
      "滿團\n23388+"
    ],
    "main": [
      "TYO06MM260213AM2\n喜遊馬年鴻運來【機加酒．東京自由行５日】樂桃5+1天、新橋區、濱松町TAVINOS HAMAMATSUCHO、日式漫畫風、含輕食早餐\n*JR:「濱松町」站北口步行約8分鐘\n*地鐵:海鷗線竹芝站步行1分鐘 (直通)\n自都營大江戶線站B2出口步行約8分鐘,搭電梯自B4出口步行約8分鐘,自東京單軌電車「濱松町」站步行約8分鐘\n*機場:\n*從羽田機場乘坐東京單軌電車時：從“羽田機場第一航站樓”乘坐開往濱松町的火車，在“濱松町站”下車，步行10分鐘。\n*從成田機場使用京成SKYLINER時：從“機場2號航站樓\n已售完\n選擇出發日期\n2月 2026\n日\n一\n二\n三\n四\n五\n六\n1\n2\n3\n4\n5\n滿團\n19888+\n6\n滿團\n19888+\n7\n8\n9\n10\n11\n滿團\n21388+\n12\n滿團\n23388+\n13\n滿團\n27888+\n14\n可售：2\n34888+\n15 春節\n可售：2\n33888+\n16 除夕\n可售：2\n33888+\n17 春節\n滿團\n35388+\n18 春節\n滿團\n34388+\n19 春節\n滿團\n27388+\n20 補假\n可售：2\n23388+\n21\n可售：2\n19888+\n22\n可售：2\n18388+\n23\n滿團\n18388+\n24\n可售：2\n19388+\n25\n滿團\n22888+\n26\n可售：2\n22888+\n27 補假\n滿團\n22888+\n28 和平\n滿團\n22888+\n選擇行程\n2026/2/5\n星期四\nTYO05MM260205AM 桃園出發\nMM626 樂桃航空 10:40 → 14:55\n滿團\nTWD19,888起\n2026/2/6\n星期五\nTYO05MM260206AM 桃園出發\nMM626 樂桃航空 10:40 → 14:55\n滿團\nTWD19,888起\n2026/2/11\n星期三\nTYO05MM260211AM 桃園出發\nMM626 樂桃航空 10:40 → 14:55\n滿團\nTWD21,388起\n2026/2/12\n星期四\nTYO05MM260212AM 桃園出發\nMM626 樂桃航空 10:40 → 14:55\n滿團\nTWD23,388起\n2026/2/12\n星期四\nTYO05TR260212HO 桃園出發\nTR898. 酷航空 06:40 → 10:40\n滿團\nTWD24,500起\n2026/2/13\n星期五\nTYO06MM260213AM2 桃園出發\nMM620 樂桃航空 02:25 → 06:30\n滿團\nTWD27,888起\n2026/2/14\n星期六\nTYO06MM260214AM2 桃園出發\nMM620 樂桃航空 02:25 → 06:30\n可售：2\nTWD34,888起\n2026/2/15\n星期日\nTYO06MM260215AM2 桃園出發\nMM620 樂桃航空 02:25 → 06:30\n可售：2\nTWD33,888起\n2026/2/16\n星期一\nTYO06MM260216AM2 桃園出發\nMM620 樂桃航空 02:25 → 06:30\n可售：2\nTWD33,888起\n2026/2/17\n星期二\nTYO05MM260217AM 桃園出發\nMM626 樂桃航空 10:40 → 14:55\n滿團\nTWD35,388起\n2026/2/18\n星期三\nTYO05MM260218AM 桃園出發\nMM626 樂桃航空 10:40 → 14:55\n滿團\nTWD34,388起\n2026/2/19\n星期四\nTYO05MM260219AM 桃園出發\nMM626 樂桃航空 10:40 → 14:55\n滿團\nTWD27,388起\n2026/2/20\n星期五\nTYO05MM260220AM 桃園出發\nMM626 樂桃航空 10:40 → 14:55\n可售：2\nTWD23,388起\n2026/2/20\n星期五\nTYO06MM260220AMA 桃園出發\nMM620 樂桃航空 02:25 → 06:30\n可售：2\nTWD33,888起\n2026/2/21\n星期六\nTYO05MM260221AM 桃園出發\nMM626 樂桃航空 10:40 → 14:55\n可售：2\nTWD19,888起\n2026/2/21\n星期六\nTYO06MM260221AMA 桃園出發\nMM620 樂桃航空 02:25 → 06:30\n可售：2\nTWD33,888起\n2026/2/22\n星期日\nTYO05MM260222AM 桃園出發\nMM626 樂桃航空 10:40 → 14:55\n可售：2\nTWD18,388起\n2026/2/23\n星期一\nTYO05TR260223HO 桃園出發\nTR898. 酷航空 06:40 → 10:40\n滿團\nTWD18,388起\n2026/2/23\n星期一\nTYO05MM260223AM 桃園出發\nMM626 樂桃航空 10:40 → 14:55\n可售：2\nTWD18,588起\n2026/2/24\n星期二\nTYO05MM260224AM 桃園出發\nMM626 樂桃航空 10:40 → 14:55\n可售：2\nTWD19,388起\n2026/2/25\n星期三\nTYO05MM260225AM 桃園出發\nMM626 樂桃航空 10:40 → 14:55\n滿團\nTWD22,888起\n2026/2/26\n星期四\nTYO05TR260226HO 桃園出發\nTR898. 酷航空 06:40 → 10:40\n可售：2\nTWD22,888起\n2026/2/27\n星期五\nTYO05MM260227AM 桃園出發\nMM626 樂桃航空 10:40 → 14:55\n滿團\nTWD22,888起\n2026/2/28\n星期六\nTYO05MM260228AM 桃園出發\nMM626 樂桃航空 10:40 → 14:55\n滿團\nTWD22,888起\n2026/3/2\n星期一\nTYO05TR260302HO 桃園出發\nTR898. 酷航空 06:40 → 10:40\n可售：2\nTWD17,999起\n2026/3/3\n星期二\nTYO05MM260303AM 桃園出發\nMM626 樂桃航空 10:40 → 14:55\n可售：2\nTWD20,988起\n2026/3/4\n星期三\nTYO05MM260304AM 桃園出發\nMM626 樂桃航空 10:40 → 14:55\n滿團\nTWD21,388起\n2026/3/9\n星期一\nTYO05TR260309HO 桃園出發\nTR898. 酷航空 06:40 → 10:40\n可售：2\nTWD18,388起\n2026/3/10\n星期二\nTYO05MM260310AM 桃園出發\nMM626 樂桃航空 10:40 → 14:55\n可售：2\nTWD19,900起\n2026/3/11\n星期三\nTYO05MM260311AM 桃園出發\nMM626 樂桃航空 10:40 → 14:55\n可售：2\nTWD20,888起\n2026/3/12\n星期四\nTYO05MM260312AM 桃園出發\nMM626 樂桃航空 10:40 → 14:55\n可售：2\nTWD20,588起\n2026/3/13\n星期五\nTYO05MM260313AM 桃園出發\nMM626 樂桃航空 10:40 → 14:55\n可售：2\nTWD20,388起\n2026/3/14\n星期六\nTYO05MM260314AM 桃園出發\nMM626 樂桃航空 10:40 → 14:55\n可售：2\nTWD19,888起\n2026/3/15\n星期日\nTYO05TR260315HO 桃園出發\nTR898. 酷航空 06:40 → 10:40\n滿團\nTWD15,999起\n2026/3/17\n星期二\nTYO05TR260317HO 桃園出發\nTR898. 酷航空 06:40 → 10:40\n可售：2\nTWD18,388起\n2026/3/19\n星期四\nTYO05TR260319HO 桃園出發\nTR898. 酷航空 06:40 → 10:40\n可售：2\nTWD18,888起\n2026/3/19\n星期四\nTYO05MM260319AM 桃園出發\nMM626 樂桃航空 10:40 → 14:55\n可售：2\nTWD20,988起\n2026/3/20\n星期五\nTYO05MM260320AM 桃園出發\nMM626 樂桃航空 10:40 → 14:55\n可售：2\nTWD20,688起\n2026/3/21\n星期六\nTYO05MM260321AM 桃園出發\nMM626 樂桃航空 10:40 → 14:55\n可售：2\nTWD21,588起\n2026/3/22\n星期日\nTYO05MM260322AM 桃園出發\nMM626 樂桃航空 10:40 → 14:55\n可售：2\nTWD22,088起\n2026/3/23\n星期一\nTYO05TR260323HO 桃園出發\nTR898. 酷航空 06:40 → 10:40\n可售：2\nTWD20,800起\n2026/3/23\n星期一\nTYO05MM260323AM 桃園出發\nMM626 樂桃航空 10:40 → 14:55\n可售：2\nTWD22,888起\n2026/3/24\n星期二\nTYO05MM260324AM 桃園出發\nMM626 樂桃航空 10:40 → 14:55\n可售：2\nTWD23,888起\n2026/4/1\n星期三\nTYO05TR260401HO 桃園出發\nTR876. 酷航空 06:45 → 11:10\n可售：2\nTWD26,888起\n2026/4/6\n星期一\nTYO05TR260406HO 桃園出發\nTR876. 酷航空 06:45 → 11:10\n可售：2\nTWD20,888起\n2026/4/9\n星期四\nTYO05TR260409HO 桃園出發\nTR876. 酷航空 06:45 → 11:10\n可售：2\nTWD20,388起\n2026/4/23\n星期四\nTYO05TR260423HO 桃園出發\nTR876. 酷航空 06:45 → 11:10\n可售：2\nTWD18,888起\n2026/5/21\n星期四\nTYO05TR260521HO 桃園出發\nTR876. 酷航空 06:45 → 11:10\n可售：2\nTWD17,988起\n2026/5/23\n星期六\nTYO05TR260523HO 桃園出發\nTR876. 酷航空 06:45 → 11:10\n可售：2\nTWD17,888起\n2026/6/4\n星期四\nTYO05TR260604HO 桃園出發\nTR876. 酷航空 06:45 → 11:10\n可售：2\nTWD18,388起\n2026/6/20\n星期六\nTYO05TR260620HO 桃園出發\nTR876. 酷航空 06:45 → 11:10\n可售：2\nTWD18,988起\n2026/6/22\n星期一\nTYO05TR260622HO 桃園出發\nTR876. 酷航空 06:45 → 11:10\n滿團\nTWD16,988起\n2026/6/25\n星期四\nTYO05TR260625HO 桃園出發\nTR876. 酷航空 06:45 → 11:10\n可售：2\nTWD19,888起\n2026/7/1\n星期三\nTYO05TR260701HO 桃園出發\nTR876. 酷航空 06:45 → 11:10\n可售：2\nTWD19,500起\n2026/7/5\n星期日\nTYO05TR260705HO 桃園出發\nTR876. 酷航空 06:45 → 11:10\n可售：2\nTWD17,988起\n2026/7/22\n星期三\nTYO05TR260722HO 桃園出發\nTR876. 酷航空 06:45 → 11:10\n可售：2\nTWD18,588起\n2026/8/2\n星期日\nTYO05TR260802HO 桃園出發\nTR876. 酷航空 06:45 → 11:10\n可售：2\nTWD17,988起\n2026/8/20\n星期四\nTYO05TR260820HO 桃園出發\nTR876. 酷航空 06:45 → 11:10\n可售：2\nTWD17,988起\n2026/9/3\n星期四\nTYO05TR260903HO 桃園出發\nTR876. 酷航空 06:45 → 11:10\n可售：2\nTWD17,500起\n2026/9/12\n星期六\nTYO05TR260912HO 桃園出發\nTR876. 酷航空 06:45 → 11:10\n可售：2\nTWD16,988起\n2026/10/4\n星期日\nTYO05TR261004HO 桃園出發\nTR876. 酷航空 06:45 → 11:10\n可售：2\nTWD16,388起\n2026/10/5\n星期一\nTYO05TR261005HO 桃園出發\nTR876. 酷航空 06:45 → 11:10\n可售：2\nTWD16,888起\n2026/10/15\n星期四\nTYO05TR261015HO 桃園出發\nTR876. 酷航空 06:45 → 11:10\n可售：2\nTWD17,588起\n交通\n方式\n行程\n特色\n行程\n介紹\n注意\n事項\n交通方式\n去程\n2026/02/13\nMM620\n樂桃航空\n桃園(TPE)\n02:25\n→\n東京[成田](NRT)\n06:30\n回程\n2026/02/17\nMM627\n樂桃航空\n東京[成田](NRT)\n22:05\n→\n桃園(TPE)\n01:25+1\n實際交通資訊以說明會資料為主\n行程特色\n食尚讚住\n◆濱松町TAVINOS◆\n\n打開房門的那一瞬間，心情彷彿躍入「MANGA（漫畫）」世界的獨特客房。\n★交通：\n・從海鷗線竹芝站步行1分鐘 (直通)\n・自JR「濱松町」站北口步行約8分鐘\n・自都營大江戶線「大門」站B2出口步行約8分鐘\n（搭電梯自B4出口步行約8分鐘）\n・自東京單軌電車「濱松町」站步行約8分鐘\n・從成田機場使用京成Skyliner時：從“機場2號航站樓”乘坐開往京成上野的Keisei Limited Express Skyliner。大約30分鐘後，在“日暮里站”下車，然後轉乘JR京濱東北線/根岸線。乘坐“大船線”在“ Hamamatsucho”站下車。步行10分鐘\n★設施：\n全館免費WIFI\n溫馨提醒\n※ 飯店房型若無特別指定，將一律以非吸菸房訂出，但實際房型需以飯店安排為主。\n※ 若於下述報價中無您喜愛的酒店，可另外提供您所期望的酒店另行報價，本公司將針對您的需求量身規劃屬於您的專屬假期。\n- 不保證所有酒店皆有報價。\n※ 若遇跨年、過年需另外報價。\n\n✍【注意事項】\n出發前請詳閱日本在台交流協會網站相關法規\n//www.koryu.or.jp/tw/\n● 本行程使用機票，須同進同出，一經確認後如個人因素取消或被拒絕入境日本，將無法申請退費。\n● 每位旅客姓名的英文拼音必須與護照完全相同，開票前敬請務必確認，如有錯誤，本公司有權收取變更所衍生之費用。\n● 行程最終使用之正確航班以行前說明會資料為準，航班時間部份，航空公司保留彈性調整之權利，不便之處敬請見諒！\n● 保證住房：距入住日7個工作天內或飯店所在城市有大型展覽、或當地旺季之飯店預訂，均為保證住房之期間，需先之付「保證住房作業金」後始可開始訂房作業，確認保證入住後之任何取消或變更將無法預付之費用。若您需求的飯店客滿，我們將建議同等級飯店，您可選擇接受或補差額。\n(保證訂房並不表示您所需求的飯店一定有房，但若有房則不可取消訂房。)\n✈註：由於酒店售價波動頻繁，表列報價只能以平日正常酒店入住費用為報價基準；若遇調漲或會展期間或各種其它狀況時，我們將會於您訂購後，與您確認相關正確費用，不便之處，尚請多多見諒。\n行程介紹\n第 1 天\n桃園／東京\n餐食\n早\nx\n午\nx\n晚\nx\n住宿\nHOTEL TAVINOS濱松町\n或同級\n第 2 天\n東京自由行\n餐食\n早\n輕食早餐\n午\nx\n晚\nx\n住宿\nHOTEL TAVINOS濱松町\n或同級\n第 3 天\n東京自由行\n餐食\n早\n輕食早餐\n午\nx\n晚\nx\n住宿\nHOTEL TAVINOS濱松町\n或同級\n第 4 天\n東京自由行\n餐食\n早\n輕食早餐\n午\nx\n晚\nx\n住宿\nHOTEL TAVINOS濱松町\n或同級\n第 5 天\n東京／桃園\n餐食\n早\n輕食早餐\n午\nx\n晚\nx\n住宿\n第 6 天\n桃園\n餐食\n早\nX\n午\nX\n晚\nX\n住宿\n注意事項\n參團須知\n1.每位旅客姓名的英文拼音必須與護照完全相同，若已開立機票則不可變更，一經開票無退票價值。航班時間以航空公司公告為主。為確保航班臨時異動可即時通知，請旅客務必提供正確的聯絡電話。\n2.本網站報價將因機票、飯店、匯率等各種因素而時有變動，得依完成訂購後的報價為準。\n3.本網站行程住宿之飯店優惠對象為持台灣護照之國人，持外國護照入住者須另行報價，且請先自行查明相關規定，並務必於報名時，明白告知您的客服人員。\n4.旅客若報名參加自由行，本公司並無提供收取旅客護照之服務(即旅客需自行保管、攜帶)，故請您務必自行檢查護照相關使用規定，如：有效期限(6個月以上)、役男問題、頁數等，若有任何問題，請洽您的客服人員。\n5.每種房型都有入住人數限制，若當地有親友加入，超出原先的安排，飯店有權拒絕旅客入住或要求旅客支付差價。\n6.本網站標示的飯店星級別乃依據旅遊市場一般公認的建議而定，並非本公司之主觀認定。\n護照效期與簽證須知\n1.本行程適用對象均為持中華民國護照之旅客(至出國當日護照效期需六個月以上)，若貴賓擁有雙重國籍或持他國護照，請先自行查明出入境(台灣入出國及移民署全球資訊網、日本交流協會台灣事務所)之相關規定，報名時並請主動告知您的服務人員。\n\n日本在台交流協會<br>\n飯店說明\n1.飯店住宿為全程兩人一室，一人報名請補單人房差價。若一位大人加一位小孩同行，小孩則必需佔床。\n2.床型如有特殊需求請提前告知，只能需求但是不能保證以實際當地入住為主。\n3.訂房一經確認後，如要取消飯店將收取取消費，尤其以五星級飯店最為嚴格，請務必在訂房時確認您的需求，謝謝！\n4.房型定義：\n單人房(SGL)：標準的單人房一張床。\n雙人房一中床(SEMI-DBLB)：單人房加床或較小的雙人房(房型需以飯店安排為主)，房間面積及床的尺寸都較小，若可接受再行預訂。\n雙人房一張床(DBLB)：標準的雙人房一張床。\n雙人房二張床(TWIN)：標準的雙人房二張床。\n三人房(TRP)：雙人房(一張床或是二張床)再加床，加床方式可能為行軍床或是沙發床或是標準單床(房型需以飯店安排為主)。\n**出發後若有任何房型變更需視飯店現場情況，費用亦須以飯店現場價格為準。\n\n5.部分酒店不提供個人用品（如：毛巾、牙刷、牙膏、沐浴乳、洗髮精、香皂、拖鞋及個人習慣性藥品等）請自行攜帶。若須多加備品、寢具等，部分酒店須自行至櫃台付費領取。\n6.通常入住(Check-in)時間約為當地時間15：00；退房(Check-out)時間為當地時間中午11：00或12：00前；實際情形仍須視各酒店規定。如有提前住房、延後退房，請自行與酒店洽詢。\n7.自由行旅客請特別注意：國外飯店常有《押金入住》規定。當辦理Checkin時，飯店會要求收取押金(可押現金或刷卡)。現金金額須視飯店規定，刷卡則為一張空白帳單。當辦理Checkout時務必取回現金或當場撕毀刷卡單，以確保個人權益。\n『東京、大阪、京都、金澤市、俱知安町、(2020年4月起)福岡』當地市政府針對旅客加收住宿城市稅，收取金額約為日幣100~1000/每人每晚，「俱知安町」將以總房費的2%作為宿泊稅，實際費用依照房費而定；『大阪、部分城市』溫泉設施旅館收取入湯税日幣150起/每人每晚，稅金費用須直接由客人於飯店現場支付，並非所有飯店皆會收取，請於飯店現場確認。\n8.因各飯店辦理入住年齡限制不一，未滿20歲旅客請於需求訂房時與客服人員再次確認飯店是否可辦理入住。\n9.特殊需求（如：床型一大床或二小床、高或低樓層、吸煙或禁煙房、非邊間或連通房等）請事先告知業務，業務僅代向飯店提出需求。實際情況仍須視飯店當日房況安排而定。\n10.兒童不佔床，指2-12歲不佔床位的兒童，一般飯店一間房僅允許一名不佔床與大人同住，若一大+一小不佔床入住雙人房，仍是需要付兩個人的房間費用。一般6歲以上小孩就必須佔床(實際依飯店規定為主)\n航空票務相關提醒\n1.※如訂購低成本航空(TR.MM.IT等…)產品提醒如下\n(為免爭議請於購買前詳細閱讀，一經付款完成代表您了解並全權同意以下規範。)\n\n2.本行程使用團體經濟艙票種來回，坐位安排照英文姓名字母順序，同行旅客不一定相鄰，無法免費選位，若有需求可於開票前自費加價選位。\n3.每位佔位旅客皆含去/回程各20公斤託運行李及一件手提行李(尺寸需小於54cmx38cmx23cm，上述尺寸包含輪子及手把等外部突出物)，與一件個人隨身物品(如手提包、電腦包或免稅商品)，共計二件，總重不得超過7公斤(樂桃/酷航)10KG(台虎);嬰兒票恕不提供任何免費行李托運或手提行李件數。\n4.注意事項及退票規定：機位一經開票確認後不可更改航班、日期與行程、不可退費，亦無法加價選位、加購機上餐食及加購託運行李等作業，也不可更改姓名或拼音，恕無法提供相關退費證明。\n5.取消規定：若因旅客個人因素取消行程，將收取全額機票費用；若因天災等不可抗力之因素致班機延誤或取消，不提供旅客轉乘其他航空公司班機之服務、亦不提供安排旅客住宿之服務，建議您另外加購相關保險。\n6.回程日計算未滿2歲需購買嬰兒票。因應航空公司飛安政策，每個航班僅提供10席嬰兒不佔位，(訂位時請事先告知並提供護照英文名和出生年月日)，如指定搭乘航班嬰兒人數超過規定限制、導致無法偕同嬰兒同行，可全額退費。一位成人僅能偕同一位不佔位嬰兒坐在膝上。(恕不提供搖籃服務)；免費提供一件嬰兒推車託運，不提供座位/嬰兒搖籃/託運行李/機上餐食。\n7.孕婦搭乘之規定會因各航空公司而有所不同，一般懷孕二十八至三十六週須請產檢醫生填寫航空公司專用診斷書，三十六週後須醫護人員同行搭乘或禁止搭乘，相關規定依航空公司之規定為主。\n8.航空公司保有最終航班時間及託運行李規定之變更權利，如有異動請依航空公司官網公告為準，恕不另行通知不便之處，敬請見諒。\n自由行旅遊商品作業金繳交規範作業約定\n其他相關資訊\n1.【電壓】\n日本電壓100伏特，一般旅館的電流都有110和220伏特。\n2.※訂位作業相關規定\n(1)本行程當您確認行程與出發日之後，請於訂購時支付NT$10,000起/人作為作業金(特殊節假日除外)，若訂位與訂房皆確認OK，則作業金自動轉為訂金，若遇原訂機位艙等或飯店已滿，請旅客加價其他艙等或另擇出發日期或退還作業金。\n(2)請務必先給旅客「謢照影本」來作業。\n\n3.※訂房相關規定\n(1)訂房後最晚兩個工作天回覆訂房狀況，如逢所訂飯店或房型客滿時，本公司將以同級飯店替代或升等房型（旅客需補房型升等價差），或是退還費用，造成您的不便敬請見諒，並請恕無法賠償！\n(2)本行程飯店若需全程保證入住，訂房一經確認後，如取消或變更將收取全額房間之取消費，若有不足之費用，則需補足全額房間費用，請謹慎確認。\n(3)由於酒店售價波動頻繁，表列報價只能以平日正常酒店入住費用為報價基準；本行程外網所秀出的售價，為此區段出發時間之最低售價，並非適用所有出發日期及所有飯店，若遇調漲或會展期間或各種其它狀況時，我們將會於您訂購後，與您確認相關正確費用，不便之處，尚請多多見諒。\n4.【時差】\n較台灣快約一小時。"
    ]
  }
}